{
  "schema": "dkim2.draft-issues.v1",
  "message_draft": "draft-ietf-dkim-dkim2-spec-07",
  "dns_draft": "draft-ietf-dkim-dkim2-dns-01",
  "issues": [
    {
      "id": "DKIM2-ISSUE-0001",
      "title": "Architecture document references remain unspecified",
      "sections": ["Draft-07 Section 1.1"],
      "class": "tba",
      "local_status": "not_implemented",
      "upstream_status": "not_reported",
      "behavior_owner": "docs/ARCHITECTURE.md",
      "conformance_cases": [],
      "test_refs": [],
      "external_cases": [],
      "public_effect": "reference-limitation",
      "resolution_criterion": "published-architecture-references",
      "claim_classes": ["draft_normative"],
      "upstream_reference": "https://www.ietf.org/archive/id/draft-ietf-dkim-dkim2-spec-07.txt"
    },
    {
      "id": "DKIM2-ISSUE-0002",
      "title": "Full-chain policy guidance document remains unspecified",
      "sections": ["Draft-07 Section 13"],
      "class": "tba",
      "local_status": "not_implemented",
      "upstream_status": "not_reported",
      "behavior_owner": "lib/internal/policy",
      "conformance_cases": [],
      "test_refs": [],
      "external_cases": [],
      "public_effect": "policy-limitation",
      "resolution_criterion": "published-policy-guidance",
      "claim_classes": ["draft_normative"],
      "upstream_reference": "https://www.ietf.org/archive/id/draft-ietf-dkim-dkim2-spec-07.txt"
    },
    {
      "id": "DKIM2-ISSUE-0003",
      "title": "EAI domain mapping uses a strict IDNA2008 profile with a known category gap",
      "sections": ["Draft-07 Section 18"],
      "class": "ambiguity",
      "local_status": "implemented_interpretation",
      "upstream_status": "not_reported",
      "behavior_owner": "lib/internal/domainname",
      "conformance_cases": [],
      "test_refs": ["lib/internal/domainname/domainname_test.go#TestToASCIIConvertsValidLabels", "lib/internal/domainname/domainname_test.go#TestToASCIIRejectsInvalidAndMappedInput", "lib/internal/signature/envelope_eai_test.go#TestCanonicalEnvelopePathMapsULabelsToALabels"],
      "external_cases": [],
      "public_effect": "idna-strict-profile-nv8-gap",
      "resolution_criterion": "complete-idna2008-validator",
      "claim_classes": ["documented_interpretation", "draft_normative"],
      "upstream_reference": "https://www.ietf.org/archive/id/draft-ietf-dkim-dkim2-spec-07.txt"
    },
    {
      "id": "DKIM2-ISSUE-0004",
      "title": "IANA considerations remain unspecified",
      "sections": ["Draft-07 Section 19"],
      "class": "tba",
      "local_status": "not_implemented",
      "upstream_status": "not_reported",
      "behavior_owner": "docs/reference",
      "conformance_cases": [],
      "test_refs": [],
      "external_cases": [],
      "public_effect": "registry-limitation",
      "resolution_criterion": "published-iana-considerations",
      "claim_classes": ["draft_normative"],
      "upstream_reference": "https://www.ietf.org/archive/id/draft-ietf-dkim-dkim2-spec-07.txt"
    },
    {
      "id": "DKIM2-ISSUE-0005",
      "title": "Draft security considerations remain unspecified",
      "sections": ["Draft-07 Section 20"],
      "class": "tba",
      "local_status": "not_implemented",
      "upstream_status": "not_reported",
      "behavior_owner": "docs/security-testing.md",
      "conformance_cases": [],
      "test_refs": [],
      "external_cases": [],
      "public_effect": "draft-security-limitation",
      "resolution_criterion": "published-security-considerations",
      "claim_classes": ["draft_normative", "local_security_policy"],
      "upstream_reference": "https://www.ietf.org/archive/id/draft-ietf-dkim-dkim2-spec-07.txt"
    },
    {
      "id": "DKIM2-ISSUE-0006",
      "title": "Uppercase header tag names are rejected rather than ignored",
      "sections": ["Draft-07 Sections 8, 9, and 10"],
      "class": "external_disagreement",
      "local_status": "implemented_interpretation",
      "upstream_status": "reporting_requires_authorization",
      "behavior_owner": "lib/internal/tagvalue",
      "conformance_cases": ["signing/tag-case-interpretation"],
      "test_refs": ["lib/internal/signature/parser_test.go#TestParseRejectsMixedCaseTagNames", "lib/internal/tagvalue/scanner_test.go#TestScanHeaderRejectsUppercaseTagNames"],
      "external_cases": ["mailauthlens/signature-mixed-case"],
      "public_effect": "uppercase-tag-name-permerror",
      "resolution_criterion": "upstream-case-clarification",
      "claim_classes": ["documented_interpretation", "external_observation"],
      "upstream_reference": "https://mailarchive.ietf.org/arch/msg/ietf-dkim/LKutLi03M6QvjgAxV0ktjqpdOzQ",
      "observation_date": "2026-07-29"
    },
    {
      "id": "DKIM2-ISSUE-0007",
      "title": "Binary body and UTF-8 header preservation interpretation",
      "sections": ["Draft-07 Section 2.9", "RFC 5322 Sections 2.2 and 2.3"],
      "class": "ambiguity",
      "local_status": "implemented_interpretation",
      "upstream_status": "not_reported",
      "behavior_owner": "lib/internal/rawmsg",
      "conformance_cases": ["raw-message/utf8-binary"],
      "test_refs": ["lib/internal/rawmsg/parser_test.go#TestParsePreservesValidUTF8HeaderAndArbitraryBodyBytes"],
      "external_cases": [],
      "public_effect": "byte-preservation-contract",
      "resolution_criterion": "upstream-byte-model-clarification",
      "claim_classes": ["documented_interpretation"]
    },
    {
      "id": "DKIM2-ISSUE-0008",
      "title": "Recipe application and inverse generation require exact local rules",
      "sections": ["Draft-07 Sections 4 through 9.2"],
      "class": "ambiguity",
      "local_status": "implemented_interpretation",
      "upstream_status": "not_reported",
      "behavior_owner": "lib/internal/recipe",
      "conformance_cases": ["recipe/application", "recipe/generation"],
      "test_refs": [
        "lib/internal/recipe/apply_header_test.go#TestApplyHeadersReversesEveryEmission",
        "lib/internal/recipe/generation_proof_test.go#TestGenerateProvesParsedRecipeRoundTrip"
      ],
      "external_cases": [],
      "public_effect": "deterministic-nonminimal-recipes",
      "resolution_criterion": "upstream-recipe-algorithm-clarification",
      "claim_classes": ["documented_interpretation"]
    },
    {
      "id": "DKIM2-ISSUE-0009",
      "title": "Policy projection modes are locally sealed",
      "sections": ["Draft-07 Section 13"],
      "class": "ambiguity",
      "local_status": "implemented_interpretation",
      "upstream_status": "not_reported",
      "behavior_owner": "lib/internal/policy",
      "conformance_cases": ["policy/projection-modes"],
      "test_refs": ["lib/policy_projection_test.go#TestFacadeTransfersAndClonesSealedPolicyProjection"],
      "external_cases": [],
      "public_effect": "policy-projection-contract",
      "resolution_criterion": "upstream-policy-projection-model",
      "claim_classes": ["documented_interpretation"]
    },
    {
      "id": "DKIM2-ISSUE-0010",
      "title": "Restricted signing output requires explicit release authority",
      "sections": ["Draft-07 Sections 10 through 14"],
      "class": "ambiguity",
      "local_status": "implemented_interpretation",
      "upstream_status": "not_upstream_issue",
      "behavior_owner": "lib/internal/routeplan",
      "conformance_cases": ["signing/restricted-release"],
      "test_refs": ["lib/signing_restricted_release_test.go#TestPublicOutOfBandReleaseIsExactAtomicAndNilOnDenial"],
      "external_cases": [],
      "public_effect": "restricted-release-contract",
      "resolution_criterion": "local-security-contract-retained",
      "claim_classes": ["documented_interpretation", "local_security_policy"]
    },
    {
      "id": "DKIM2-ISSUE-0011",
      "title": "DNS key-type ABNF uses the version-tag octet",
      "sections": ["DNS-04 Section 3.4.1", "RFC 6376 Erratum 5137"],
      "class": "discrepancy",
      "local_status": "implemented_interpretation",
      "upstream_status": "not_reported",
      "behavior_owner": "lib/internal/keyresolver",
      "conformance_cases": [],
      "test_refs": ["lib/internal/keyresolver/record_test.go#TestParseRecordUsesLowercaseKDespiteDraftABNFDefect"],
      "external_cases": [],
      "public_effect": "lowercase-k-required",
      "resolution_criterion": "dns-abnf-corrected",
      "claim_classes": ["documented_interpretation", "draft_normative"],
      "upstream_reference": "https://www.rfc-editor.org/errata/eid5137"
    },
    {
      "id": "DKIM2-ISSUE-0012",
      "title": "DNS query method has no active signature q tag",
      "sections": ["DNS-04 Section 3.1", "Draft-07 Section 10"],
      "class": "discrepancy",
      "local_status": "implemented_interpretation",
      "upstream_status": "not_reported",
      "behavior_owner": "lib/internal/keyresolver",
      "conformance_cases": [],
      "test_refs": ["lib/internal/keyresolver/record_test.go#TestParseRecordAcceptsClosedLegalMatrix"],
      "external_cases": [],
      "public_effect": "dns-txt-only",
      "resolution_criterion": "drafts-align-query-method",
      "claim_classes": ["documented_interpretation", "draft_normative"]
    },
    {
      "id": "DKIM2-ISSUE-0013",
      "title": "DNS strict-identity flag conflicts with numeric signature i tag",
      "sections": ["DNS-04 Section 3.4.4", "Draft-07 Section 10.1"],
      "class": "discrepancy",
      "local_status": "implemented_interpretation",
      "upstream_status": "not_reported",
      "behavior_owner": "lib/internal/keyresolver",
      "conformance_cases": [],
      "test_refs": ["lib/internal/keyresolver/record_test.go#TestParseRecordAcceptsClosedLegalMatrix"],
      "external_cases": [],
      "public_effect": "strict-identity-metadata-only",
      "resolution_criterion": "drafts-align-strict-identity",
      "claim_classes": ["documented_interpretation", "draft_normative"]
    },
    {
      "id": "DKIM2-ISSUE-0014",